{
  "artifacts": [
    {
      "artifactID": "22222222-2222-4222-8222-222222222222",
      "commitSequence": 0,
      "expectedExisting": "hashMatch",
      "expectedOriginalHash": "2222222222222222222222222222222222222222222222222222222222222222",
      "journalFrontier": "noteVerified",
      "kind": "note",
      "length": 25,
      "logicalPath": [
        "Synthetic Vault",
        "Inbox",
        "capture.md"
      ],
      "mediaType": "text/markdown; charset=utf-8",
      "operationID": "33333333-3333-4333-8333-333333333333",
      "receiptKind": "noteCommit",
      "sha256": "1111111111111111111111111111111111111111111111111111111111111111"
    }
  ],
  "contractVersion": 1,
  "operation": "existingNoteAppend",
  "planHash": "0000000000000000000000000000000000000000000000000000000000000000",
  "preparedByteDelivery": {
    "finalJSONDuplicatesBytes": false,
    "maximumChunkBytes": 1048576,
    "mode": "drainedImmutableArtifacts"
  },
  "rendererRevision": "swift-legacy-m0",
  "requestID": "11111111-1111-4111-8111-111111111111",
  "retryMarker": {
    "policy": "voxCaptureCommentV1",
    "syntax": "<!-- vox-capture:{lowercase-uuid} -->"
  },
  "warnings": []
}
